{
  "schema_version": 1,
  "generated_at": "2026-09-14T11:11:09.405Z",
  "as_of": "2026-09-14",
  "lookahead_days": 35,
  "authority": "planning-evidence-only",
  "pattern": "router-plus-evaluator",
  "sources": {
    "client_operations_root_available": true,
    "canonical_queue_available": true,
    "canonical_queue_source": "client-operations://queue/work-items.json",
    "deliverable_events_scanned": 28,
    "active_queue_items_scanned": 16,
    "queue_candidates_used": 5,
    "stale_queue_items_excluded": 11,
    "history_start": "2026-06-17",
    "history_end": "2026-09-14",
    "source_fingerprint": "b0d9571b093db41aff4d5238d64f60ca71f2424e3cbe1d8aa114fe4f4e4a0969"
  },
  "candidates": [
    {
      "candidate_id": "recurrence-bok-law-firm-weekly-designed-content-2026-09-15",
      "client_id": "bok-law-firm",
      "title": "BOK weekly three-topic designed content kit expected around 2026-09-15",
      "work_package_id": "bok-weekly-designed-content-kit",
      "work_package_label": "BOK weekly three-topic designed content kit",
      "secondary_work_packages": [],
      "state": "scheduled-pattern",
      "confidence": 0.96,
      "confidence_label": "confirmed-pattern",
      "evidence_tier": "owner-verified-recurrence",
      "predicted_window": {
        "start": "2026-09-15",
        "end": "2026-09-17",
        "basis": "weekly"
      },
      "reason": "Three designed topics and generated image backgrounds are expected from the latest verified pattern and Dillon's instruction; the exact current packet overrides the count.",
      "source_refs": [
        "user://2026-09-02/predictive-work-planner-scope",
        "client-operations://registry/clients.json#bok-law-firm",
        "client-operations://clients/bok-law-firm/context/operating-context.md#recurring-work-patterns",
        "client-operations://clients/bok-law-firm/deliverables/2026-09-01-three-blogs"
      ],
      "artifact_manifest": [
        "The exact weekly PDF packet or current attorney-approved source, treated as sole content truth",
        "Three expected topic and copy records; stop and surface a mismatch if the source requests another count",
        "Three topic-specific background images generated with ChatGPT image generation, one per topic, with no fabricated legal claims or text baked into the art",
        "Three branded template graphics in the required PNG and JPG formats",
        "Source and final PDFs plus a contact sheet or rendered-page inspection set",
        "Copy, geography, names, dates, distinctions, image count, and Facebook-page duplicate-check receipt"
      ],
      "prepare_now": [
        "Locate and fingerprint the newest source packet before drafting or generating images",
        "Resolve the three topics, exact copy, dates, and approved BOK template",
        "Prepare three ChatGPT image-generation prompts and output slots without publishing anything"
      ],
      "human_gates": [
        "Missing or conflicting packet, legal/geographic ambiguity, wrong Facebook page, duplicate schedule, or any content outside the exact approved source"
      ],
      "handoff": {
        "workflow_id": "predictive-work-planner-v1",
        "step_id": "prepare-bok-weekly-designed-content-kit",
        "task": "Prepare the reviewable BOK weekly three-topic designed content kit package for bok-law-firm.",
        "constraints": [
          "Resolve the exact client, account, source, repository, and destination before writing state.",
          "Treat predictions as evidence, not as authorization or proof that a request exists.",
          "No send, publish, spend, account change, or canonical queue mutation from this handoff.",
          "Stop on cross-client ambiguity, missing primary evidence, or a human-only authentication gate."
        ],
        "upstream_artifacts": [
          "user://2026-09-02/predictive-work-planner-scope",
          "client-operations://registry/clients.json#bok-law-firm",
          "client-operations://clients/bok-law-firm/context/operating-context.md#recurring-work-patterns",
          "client-operations://clients/bok-law-firm/deliverables/2026-09-01-three-blogs"
        ],
        "budget_tokens": 12000,
        "timeout_seconds": 1800
      }
    },
    {
      "candidate_id": "queue-wi-20260718-0001",
      "client_id": "bigorange-marketing",
      "title": "Confirm BigOrange paid-trial scope and compensation",
      "work_package_id": "website-design-build",
      "work_package_label": "Website, landing page, or frontend build",
      "secondary_work_packages": [],
      "state": "needs_approval",
      "confidence": 0.86,
      "confidence_label": "likely",
      "evidence_tier": "canonical-queue",
      "predicted_window": {
        "start": null,
        "end": null,
        "basis": "past-due-needs_approval"
      },
      "reason": "Keep the completed private WordPress pilot and exact review draft unsent; obtain final BigOrange factual sign-off and the exact invoice recipient, due date, and payment timing before publication or invoicing.",
      "source_refs": [
        "user-request://2026-07-17/bigorange-client-and-trial-commission",
        "client-operations://queue/work-items.json#wi-20260718-0001",
        "queue/work-items.json",
        "clients/bigorange-marketing/CLIENT.md"
      ],
      "artifact_manifest": [
        "Verified client route, site, repository, and release target",
        "Product truth, approved copy, brand assets, and visual authority",
        "Surface brief with mode, job, proof sequence, and acceptance criteria",
        "Desktop and mobile implementation with responsive states",
        "Accessibility, interaction, console, link, form, and overflow QA receipt",
        "Reviewable preview or the exact mapped live URL when standing approval applies"
      ],
      "prepare_now": [
        "Resolve the exact client, repository, current site, and deployment mapping",
        "Collect the approved logo, imagery, copy, tokens, and reference surface",
        "Write the smallest implementation and QA contract before building"
      ],
      "human_gates": [
        "New public site, ambiguous deployment target, client sign-off, credentials, or non-Netlify publication",
        "Canonical work item wi-20260718-0001 still requires its recorded approval."
      ],
      "handoff": {
        "workflow_id": "predictive-work-planner-v1",
        "step_id": "prepare-website-design-build",
        "task": "Prepare the reviewable Website, landing page, or frontend build package for bigorange-marketing.",
        "constraints": [
          "Resolve the exact client, account, source, repository, and destination before writing state.",
          "Treat predictions as evidence, not as authorization or proof that a request exists.",
          "No send, publish, spend, account change, or canonical queue mutation from this handoff.",
          "Stop on cross-client ambiguity, missing primary evidence, or a human-only authentication gate."
        ],
        "upstream_artifacts": [
          "user-request://2026-07-17/bigorange-client-and-trial-commission",
          "client-operations://queue/work-items.json#wi-20260718-0001",
          "queue/work-items.json",
          "clients/bigorange-marketing/CLIENT.md"
        ],
        "budget_tokens": 12000,
        "timeout_seconds": 1800
      }
    },
    {
      "candidate_id": "queue-wi-20260717-0002",
      "client_id": "revive-systems",
      "title": "Implement Revive live site cleanup and sitemap submission",
      "work_package_id": "workflow-automation-system",
      "work_package_label": "Workflow, automation, agent, or operating-system build",
      "secondary_work_packages": [
        {
          "profile_id": "data-source-integration",
          "label": "Data source, tracking, or API integration",
          "score": 5,
          "matches": [
            {
              "term": "search console",
              "weight": 5
            }
          ]
        },
        {
          "profile_id": "website-design-build",
          "label": "Website, landing page, or frontend build",
          "score": 4,
          "matches": [
            {
              "term": "site cleanup",
              "weight": 4
            }
          ]
        }
      ],
      "state": "blocked",
      "confidence": 0.68,
      "confidence_label": "watch",
      "evidence_tier": "canonical-queue",
      "predicted_window": {
        "start": null,
        "end": null,
        "basis": "when-gate-clears"
      },
      "reason": "Complete the human Google OAuth gate for the exact REVIVE Systems HighLevel location recorded in Access Broker, then back up the current pages, publish the reviewed changes, test the lead path, and submit the validated sitemap through the authorized Search Console identity.",
      "source_refs": [
        "clients/revive-systems/deliverables/2026-07-16-aeo-geo-seo-blog-cluster/mac-slack-alignment.md",
        "client-operations://queue/work-items.json#wi-20260717-0002",
        "clients/revive-systems/deliverables/2026-07-16-aeo-geo-seo-blog-cluster/01-completion-manifest.md"
      ],
      "artifact_manifest": [
        "Workflow objective, owner, authority, and stop conditions",
        "Source adapters, canonical identifiers, and freshness contract",
        "Router and explicit handoff schema for each step",
        "Evaluator, retry, timeout, idempotency, and circuit-breaker rules",
        "State, receipts, observability, rollback, and recovery path",
        "Dry-run and acceptance evidence with external actions still governed"
      ],
      "prepare_now": [
        "Freeze the trigger, input, output, and canonical write authority",
        "Choose the smallest sequential, router, orchestrator, or evaluator pattern that fits",
        "Define handoffs and failure states before wiring tools"
      ],
      "human_gates": [